{
  "schema_version": "2026-06-07",
  "event_id": "evt_reporting_prompt_version",
  "idempotency_key": "fixture/reporting/prompt-version",
  "project": "paper-agent",
  "agent_id": "local-agent",
  "run_id": "run_reporting",
  "span_id": null,
  "parent_span_id": null,
  "event_type": "llm.call.started",
  "occurred_at": "2026-06-07T14:32:00Z",
  "received_at": null,
  "environment": "paper",
  "symbols": ["NVDA"],
  "payload": {
    "provider": "openai",
    "model": "example-model",
    "prompt_family": "allocation",
    "prompt_version": "2026-06-07",
    "prompt_hash": "sha256:bbbbbbbbbbbbbbbbbbbbbbbbbbbbbbbbbbbbbbbbbbbbbbbbbbbbbbbbbbbbbbbb",
    "reasoning_mode": "standard",
    "tool_policy_version": "tools-1",
    "component": "harness",
    "severity": "info"
  },
  "privacy": {
    "full_io": false,
    "redaction_version": "2026-06-07",
    "contains_prompt_text": false,
    "contains_output_text": false,
    "contains_broker_payload": false,
    "contains_account_identifier": false,
    "truncated": false
  },
  "sdk": {
    "name": "ellzaf-agent-python",
    "version": "0.1.0",
    "language": "python"
  }
}
