{
  "schema_version": "2026-06-07",
  "event_id": "evt_reporting_paper_fill_close",
  "idempotency_key": "fixture/reporting/paper-fill-close",
  "project": "paper-agent",
  "agent_id": "local-agent",
  "run_id": "run_reporting",
  "span_id": null,
  "parent_span_id": null,
  "event_type": "paper.fill.recorded",
  "occurred_at": "2026-06-07T14:35:00Z",
  "received_at": null,
  "environment": "paper",
  "symbols": ["NVDA"],
  "payload": {
    "fill_id": "fill_close_1",
    "position_id": "pos_nvda_1",
    "order_intent_id": "order_intent_exit_1",
    "symbol": "NVDA",
    "side": "sell",
    "open_close_effect": "close",
    "quantity": "2",
    "price": "101.00",
    "fees": "0.25",
    "currency": "USD",
    "fill_source": "paper",
    "session_date": "2026-06-07",
    "strategy_id": "strat_breakout_quality",
    "setup": "earnings_gap_hold",
    "component": "execution",
    "severity": "info"
  },
  "privacy": {
    "full_io": false,
    "redaction_version": "2026-06-07",
    "contains_prompt_text": false,
    "contains_output_text": false,
    "contains_broker_payload": false,
    "contains_account_identifier": false,
    "truncated": false
  },
  "sdk": {
    "name": "ellzaf-agent-python",
    "version": "0.1.0",
    "language": "python"
  }
}
